{
  "kind": "runtime",
  "id": "hair-worker",
  "owner": "hair-lab",
  "summary": "Worker and derived geometry query buffers belonging to a demanded groom evaluation.",
  "status": "target",
  "environment": "page",
  "key": [
    "type:hair-lab-session",
    "groom revision",
    "character geometry revision"
  ],
  "factory": "planned",
  "ready": "process:hair-generate",
  "query": [],
  "linger": 0
}
